played_at;track.name;name;played;day
2023-10-15T11:29:07.986Z;That's It!;Preservation Hall Jazz Band;2023-10-15 11:29:07.986;2023-10-15
2023-10-15T11:33:44.888Z;Optinen harha (feat. Ellips);Pyhimys;2023-10-15 11:33:44.888;2023-10-15
2023-10-15T13:13:48.275Z;Embryo;Hot Swing Sextet;2023-10-15 13:13:48.275;2023-10-15
2023-10-15T13:54:21.998Z;All the Cats Join In;Allotria Jazz Band;2023-10-15 13:54:21.998;2023-10-15
2023-10-15T14:19:43.483Z;That's It!;Preservation Hall Jazz Band;2023-10-15 14:19:43.483;2023-10-15
